[
  { "id": "club", "damage": "1d4", "damageType": "bludgeoning", "stat": "str", "finesse": false, "ranged": false, "range": 1, "reach": false, "tags": ["simple", "light"] },
  { "id": "dagger", "damage": "1d4", "damageType": "piercing", "stat": "dex", "finesse": true, "ranged": false, "range": 1, "reach": false, "tags": ["simple", "light", "thrown"] },
  { "id": "greatclub", "damage": "1d8", "damageType": "bludgeoning", "stat": "str", "finesse": false, "ranged": false, "range": 1, "reach": false, "tags": ["simple", "two_handed"] },
  { "id": "handaxe", "damage": "1d6", "damageType": "slashing", "stat": "str", "finesse": false, "ranged": false, "range": 1, "reach": false, "tags": ["simple", "light", "thrown"] },
  { "id": "javelin", "damage": "1d6", "damageType": "piercing", "stat": "str", "finesse": false, "ranged": true, "range": 4, "reach": false, "tags": ["simple", "thrown"] },
  { "id": "light_hammer", "damage": "1d4", "damageType": "bludgeoning", "stat": "str", "finesse": false, "ranged": false, "range": 1, "reach": false, "tags": ["simple", "light", "thrown"] },
  { "id": "mace", "damage": "1d6", "damageType": "bludgeoning", "stat": "str", "finesse": false, "ranged": false, "range": 1, "reach": false, "tags": ["simple"] },
  { "id": "quarterstaff", "damage": "1d6", "damageType": "bludgeoning", "stat": "str", "finesse": false, "ranged": false, "range": 1, "reach": false, "tags": ["simple", "versatile"] },
  { "id": "sickle", "damage": "1d4", "damageType": "slashing", "stat": "str", "finesse": false, "ranged": false, "range": 1, "reach": false, "tags": ["simple", "light"] },
  { "id": "spear", "damage": "1d6", "damageType": "piercing", "stat": "str", "finesse": false, "ranged": false, "range": 1, "reach": false, "tags": ["simple", "thrown", "versatile"] },
  { "id": "dart", "damage": "1d4", "damageType": "piercing", "stat": "dex", "finesse": true, "ranged": true, "range": 4, "reach": false, "tags": ["simple", "thrown"] },
  { "id": "light_crossbow", "damage": "1d8", "damageType": "piercing", "stat": "dex", "finesse": false, "ranged": true, "range": 6, "reach": false, "tags": ["simple", "two_handed", "loading"] },
  { "id": "shortbow", "damage": "1d6", "damageType": "piercing", "stat": "dex", "finesse": false, "ranged": true, "range": 6, "reach": false, "tags": ["simple", "two_handed"] },
  { "id": "sling", "damage": "1d4", "damageType": "bludgeoning", "stat": "dex", "finesse": false, "ranged": true, "range": 4, "reach": false, "tags": ["simple"] },
  { "id": "battleaxe", "damage": "1d8", "damageType": "slashing", "stat": "str", "finesse": false, "ranged": false, "range": 1, "reach": false, "tags": ["martial", "versatile"] },
  { "id": "flail", "damage": "1d8", "damageType": "bludgeoning", "stat": "str", "finesse": false, "ranged": false, "range": 1, "reach": false, "tags": ["martial"] },
  { "id": "glaive", "damage": "1d10", "damageType": "slashing", "stat": "str", "finesse": false, "ranged": false, "range": 1, "reach": true, "tags": ["martial", "heavy", "two_handed"] },
  { "id": "greataxe", "damage": "1d12", "damageType": "slashing", "stat": "str", "finesse": false, "ranged": false, "range": 1, "reach": false, "tags": ["martial", "heavy", "two_handed"] },
  { "id": "greatsword", "damage": "2d6", "damageType": "slashing", "stat": "str", "finesse": false, "ranged": false, "range": 1, "reach": false, "tags": ["martial", "heavy", "two_handed"] },
  { "id": "halberd", "damage": "1d10", "damageType": "slashing", "stat": "str", "finesse": false, "ranged": false, "range": 1, "reach": true, "tags": ["martial", "heavy", "two_handed"] },
  { "id": "lance", "damage": "1d10", "damageType": "piercing", "stat": "str", "finesse": false, "ranged": false, "range": 1, "reach": true, "tags": ["martial", "heavy"] },
  { "id": "longsword", "damage": "1d8", "damageType": "slashing", "stat": "str", "finesse": false, "ranged": false, "range": 1, "reach": false, "tags": ["martial", "versatile"] },
  { "id": "maul", "damage": "2d6", "damageType": "bludgeoning", "stat": "str", "finesse": false, "ranged": false, "range": 1, "reach": false, "tags": ["martial", "heavy", "two_handed"] },
  { "id": "morningstar", "damage": "1d8", "damageType": "piercing", "stat": "str", "finesse": false, "ranged": false, "range": 1, "reach": false, "tags": ["martial"] },
  { "id": "pike", "damage": "1d10", "damageType": "piercing", "stat": "str", "finesse": false, "ranged": false, "range": 1, "reach": true, "tags": ["martial", "heavy", "two_handed"] },
  { "id": "rapier", "damage": "1d8", "damageType": "piercing", "stat": "dex", "finesse": true, "ranged": false, "range": 1, "reach": false, "tags": ["martial"] },
  { "id": "scimitar", "damage": "1d6", "damageType": "slashing", "stat": "dex", "finesse": true, "ranged": false, "range": 1, "reach": false, "tags": ["martial", "light"] },
  { "id": "shortsword", "damage": "1d6", "damageType": "piercing", "stat": "dex", "finesse": true, "ranged": false, "range": 1, "reach": false, "tags": ["martial", "light"] },
  { "id": "trident", "damage": "1d8", "damageType": "piercing", "stat": "str", "finesse": false, "ranged": false, "range": 1, "reach": false, "tags": ["martial", "thrown", "versatile"] },
  { "id": "warhammer", "damage": "1d8", "damageType": "bludgeoning", "stat": "str", "finesse": false, "ranged": false, "range": 1, "reach": false, "tags": ["martial", "versatile"] },
  { "id": "war_pick", "damage": "1d8", "damageType": "piercing", "stat": "str", "finesse": false, "ranged": false, "range": 1, "reach": false, "tags": ["martial", "versatile"] },
  { "id": "whip", "damage": "1d4", "damageType": "slashing", "stat": "dex", "finesse": true, "ranged": false, "range": 1, "reach": true, "tags": ["martial"] },
  { "id": "hand_crossbow", "damage": "1d6", "damageType": "piercing", "stat": "dex", "finesse": false, "ranged": true, "range": 6, "reach": false, "tags": ["martial", "light", "loading"] },
  { "id": "heavy_crossbow", "damage": "1d10", "damageType": "piercing", "stat": "dex", "finesse": false, "ranged": true, "range": 8, "reach": false, "tags": ["martial", "heavy", "two_handed", "loading"] },
  { "id": "longbow", "damage": "1d8", "damageType": "piercing", "stat": "dex", "finesse": false, "ranged": true, "range": 8, "reach": false, "tags": ["martial", "heavy", "two_handed"] }
]
